{
  "project_id": "demo-short",
  "version": "2026-10-13.2",
  "title": "柔和插画短片",
  "summary": "扁平柔和插画，低饱和粉彩，细线。",
  "medium": "2d_illustration",
  "palette": {
    "primary": [
      {
        "name": "blush",
        "hex": "#E8B4B8",
        "role": "primary"
      },
      {
        "name": "sage",
        "hex": "#A8C5B0",
        "role": "primary"
      }
    ],
    "accent": [
      {
        "name": "ink",
        "hex": "#2C2A29",
        "role": "accent"
      }
    ],
    "background": {
      "name": "paper",
      "hex": "#F7F1EA",
      "role": "bg"
    },
    "forbidden": [
      {
        "name": "neon_pink",
        "hex": "#FF00AA",
        "role": "forbidden"
      }
    ]
  },
  "line": {
    "weight": "thin",
    "style": "clean",
    "notes": "闭合流畅轮廓"
  },
  "lighting": {
    "mood": "soft_diffused",
    "notes": "少硬阴影"
  },
  "texture": {
    "grain": "subtle",
    "paper": true
  },
  "typography": {
    "title_font": "Noto Sans SC",
    "body_font": "Noto Sans SC",
    "title_color": {
      "hex": "#2C2A29",
      "role": "text"
    },
    "body_color": {
      "hex": "#2C2A29",
      "role": "text"
    }
  },
  "composition": {
    "preferred_framings": [
      "wide",
      "medium",
      "close_up"
    ],
    "aspect_hints": [
      "16:9"
    ],
    "notes": "静帧取景偏好；动画另见 shot_list"
  },
  "prompt_blocks": {
    "positive": "soft flat 2d illustration, pastel palette, thin clean lineart, gentle diffused light, paper texture",
    "character_lock": "same character design, large soft eyes, simple clothing folds",
    "environment_lock": "simple backgrounds, limited props, airy negative space"
  },
  "negative_constraints": [
    "no photoreal skin",
    "no neon cyberpunk glow",
    "no cluttered UI text in frame",
    "no extreme fisheye"
  ],
  "likeness_rules": [
    "prefer low-saturation pastels",
    "characters with slightly large eye spacing",
    "backgrounds stay quiet; subject reads first"
  ],
  "anchor_refs": [],
  "defaults": {
    "resolution": {
      "width": 1920,
      "height": 1080
    },
    "preview_label": "720p_still_preview",
    "final_label": "1080p_still"
  },
  "preference_appendix": {
    "do": [
      "keep pastels soft"
    ],
    "dont": [
      "over-saturated neon"
    ]
  }
}
